{
  "schema_version": "3.1",
  "scene_id": "scene-001",
  "project": "minimal-book",
  "pen_name": "fantasy-author-a",
  "job": "draft",
  "revisions": {
    "input_commit": "example-fixture",
    "canon": "canon-v1",
    "arc": "arc-v1",
    "state": "state-before-scene-001",
    "registry": "registry-v1"
  },
  "modules": ["progression", "combat"],
  "pov": {
    "character": "Mara",
    "mode": "close third, past tense",
    "knowledge_boundary": [
      "Mara knows the bridge is failing but not that it was sabotaged",
      "Mara knows only Iven's established stone-contact technique"
    ]
  },
  "purpose": "Make Mara sacrifice a qualifying advantage to rescue Iven and discover evidence of sabotage.",
  "scene_shape": {
    "opening_state": "Mara expects a controlled duel and distrusts Iven.",
    "pov_goal": "Win without exposing the weakness in her left hand.",
    "opposition": "A bridge segment fails while Iven is outside safe reach.",
    "turn": "Mara recognizes that continuing the winning attack will make rescue impossible.",
    "choice": "She abandons her advantage and catches Iven despite her injured grip.",
    "outcome": "The bout pauses; Mara loses her advantage and finds a deliberately cut seam.",
    "closing_state": "Mara has the first sabotage clue, and Iven owes her an unwanted debt."
  },
  "obligations": {
    "must_include": [
      "Mara's left-hand impairment changes how she performs the rescue",
      "Iven recognizes that Mara sacrificed a real advantage"
    ],
    "plants": ["A diagonal cut crosses the bridge segment's natural grain"],
    "payoffs": [],
    "prohibited_outcomes": [
      "Do not identify the saboteur",
      "Do not heal Mara's hand",
      "Do not invent a new ability"
    ]
  },
  "invention_budget": {
    "allowed": [
      "Unimportant arena sounds and physical details",
      "One unnamed spectator reaction",
      "Tactical movement using established abilities"
    ],
    "approval_required": ["New named characters", "New academy rules"],
    "forbidden": ["New powers", "Scoring changes", "Saboteur identity" ]
  },
  "context_files": [
    {"kind": "canon", "label": "approved canon", "path": "canon.md", "required": true},
    {"kind": "arc", "label": "arc commitments", "path": "arc.md", "required": true},
    {"kind": "state", "label": "current state", "path": "state.md", "required": true},
    {"kind": "registry", "label": "name registry", "path": "registry.md", "required": true}
  ],
  "verified_findings": [],
  "exceptions": [],
  "output": {
    "draft_path": "drafts/scene-001.md",
    "report_path": "reports/scene-001-author.json",
    "editor_report_path": "reports/scene-001-editor.json",
    "verifier_report_path": "reports/scene-001-verifier.json",
    "target_words": 900,
    "tolerance_percent": 20
  }
}
